{
  "$schema": "https://json-schema.org/draft/2020-12/schema",
  "$id": "https://schemas.bytedesk.ai/agent-delivery/v1/renderer-qualification-attempt/1.0.0",
  "title": "Fenced qualification-only renderer attempt",
  "type": "object",
  "required": [
    "contract",
    "schema",
    "attemptId",
    "attemptFencingToken",
    "qualificationSelectionDigest",
    "inputTreeDigest",
    "framedRequestDigest",
    "contractBundleDigest",
    "qualificationSuiteDigest",
    "conformancePlanDigest",
    "inputCorpusDigest",
    "evaluatorDistributionDigest",
    "qualificationWorkerProfileDigest",
    "qualificationProtocolProfileDigest",
    "sandboxProfileDigest",
    "resourceProfileDigest",
    "timeoutProfileDigest",
    "issuerIdentityDigest",
    "issuedAt",
    "expiresAt",
    "authorityDigest"
  ],
  "properties": {
    "contract": { "const": "bytedesk.renderer-qualification-attempt/1" },
    "schema": { "$ref": "https://schemas.bytedesk.ai/agent-delivery/v1/common/1.0.0#/$defs/schemaDescriptor" },
    "attemptId": { "$ref": "https://schemas.bytedesk.ai/agent-delivery/v1/common/1.0.0#/$defs/identifier" },
    "attemptFencingToken": { "$ref": "https://schemas.bytedesk.ai/agent-delivery/v1/common/1.0.0#/$defs/positiveSafeInteger" },
    "qualificationSelectionDigest": { "$ref": "https://schemas.bytedesk.ai/agent-delivery/v1/common/1.0.0#/$defs/sha256" },
    "inputTreeDigest": { "$ref": "https://schemas.bytedesk.ai/agent-delivery/v1/common/1.0.0#/$defs/sha256" },
    "framedRequestDigest": { "$ref": "https://schemas.bytedesk.ai/agent-delivery/v1/common/1.0.0#/$defs/sha256" },
    "contractBundleDigest": { "$ref": "https://schemas.bytedesk.ai/agent-delivery/v1/common/1.0.0#/$defs/sha256" },
    "qualificationSuiteDigest": { "$ref": "https://schemas.bytedesk.ai/agent-delivery/v1/common/1.0.0#/$defs/sha256" },
    "conformancePlanDigest": { "$ref": "https://schemas.bytedesk.ai/agent-delivery/v1/common/1.0.0#/$defs/sha256" },
    "inputCorpusDigest": { "$ref": "https://schemas.bytedesk.ai/agent-delivery/v1/common/1.0.0#/$defs/sha256" },
    "evaluatorDistributionDigest": { "$ref": "https://schemas.bytedesk.ai/agent-delivery/v1/common/1.0.0#/$defs/sha256" },
    "qualificationWorkerProfileDigest": { "$ref": "https://schemas.bytedesk.ai/agent-delivery/v1/common/1.0.0#/$defs/sha256" },
    "qualificationProtocolProfileDigest": { "$ref": "https://schemas.bytedesk.ai/agent-delivery/v1/common/1.0.0#/$defs/sha256" },
    "sandboxProfileDigest": { "$ref": "https://schemas.bytedesk.ai/agent-delivery/v1/common/1.0.0#/$defs/sha256" },
    "resourceProfileDigest": { "$ref": "https://schemas.bytedesk.ai/agent-delivery/v1/common/1.0.0#/$defs/sha256" },
    "timeoutProfileDigest": { "$ref": "https://schemas.bytedesk.ai/agent-delivery/v1/common/1.0.0#/$defs/sha256" },
    "issuerIdentityDigest": { "$ref": "https://schemas.bytedesk.ai/agent-delivery/v1/common/1.0.0#/$defs/sha256" },
    "issuedAt": { "$ref": "https://schemas.bytedesk.ai/agent-delivery/v1/common/1.0.0#/$defs/timestamp" },
    "expiresAt": { "$ref": "https://schemas.bytedesk.ai/agent-delivery/v1/common/1.0.0#/$defs/timestamp" },
    "authorityDigest": { "$ref": "https://schemas.bytedesk.ai/agent-delivery/v1/common/1.0.0#/$defs/sha256" }
  },
  "additionalProperties": false,
  "unevaluatedProperties": false,
  "description": "Binds the QS domain digest and exact qualification machinery readback. Production render, deployment, activation, and catalog publication reject this contract."
}
