{
  "contract": "bytedesk.renderer-qualification-attempt/1",
  "schema": {
    "id": "https://schemas.bytedesk.ai/agent-delivery/v1/renderer-qualification-attempt/1.0.0",
    "digest": "sha256:58ac68a5b4978435ccbf261bef474f39ff94bc0b7d4a1ee9e90e4162983ef91a"
  },
  "attemptId": "qualify-openclaw-amd64-1",
  "attemptFencingToken": 1,
  "qualificationSelectionDigest": "sha256:3df225d0b9448ce5fb0d9c0bb49678c92fd47b07a71e325dc758d1093568d431",
  "inputTreeDigest": "sha256:c498d7e87bb2a7f992fc0ee05f5572c3dc47728f4563cef779cd415e428f0cc3",
  "contractBundleDigest": "sha256:00e015b2dea045c7bb14cdcd9c6c7c827812f5fae11a402a6010b4514a308b41",
  "qualificationSuiteDigest": "sha256:fd9f5caa497e5c204b5be3f0e7014c74c0162af949c2115611b6370fce037842",
  "conformancePlanDigest": "sha256:02553fcdb228176babeafc445489685c040278e74fe8bcb2c3e4556d1d25fbaf",
  "inputCorpusDigest": "sha256:36d2ace03f79ea1827d60db53341635989941c7163c197a215b56938e1a80bf2",
  "evaluatorDistributionDigest": "sha256:146c5b8a1faa79183e822a1b8cfd5d8cbaf0b1b2ccb60502eb78b0c0dd4a816d",
  "qualificationWorkerProfileDigest": "sha256:c4d654a66a90705f63c460fc725354866827f0186bee49fd7ae235643302c384",
  "qualificationProtocolProfileDigest": "sha256:135ad2dd7dec9cc416f3272c495521580b5972cfde50ea9876020a239b992f42",
  "sandboxProfileDigest": "sha256:bae8babbab7c350f637eece710c26874dc98aa90ad8f75f6c87adb3be9cfd804",
  "resourceProfileDigest": "sha256:a8ea63935f5ef460ec6a9db7a16303084da85e62bd3e5128c341cb5a8a897a89",
  "timeoutProfileDigest": "sha256:776ec5b10927a8c66a9d1655e02076a7cbbf6669458c81657d5380822a911000",
  "issuerIdentityDigest": "sha256:3b7c3936c9fb8ed6a3e2a1cf793350e0c3dd342e210a08e76ed93e67a3dd60eb",
  "issuedAt": "2026-07-17T11:59:00Z",
  "expiresAt": "2026-07-17T12:05:00Z",
  "authorityDigest": "sha256:07e331fbdb23a275cfd3763ee74cb128d49a492827aa49af5dea660f6c7deed6",
  "framedRequestDigest": "sha256:fe1517722079cb505722a3dbc63055c177e78817ee4dcb9e9f79f1e00bb760ff"
}
