{
  "contract": "bytedesk.renderer-qualification-attempt/1",
  "schema": {
    "id": "https://schemas.bytedesk.ai/agent-delivery/v1/renderer-qualification-attempt/1.0.0",
    "digest": "sha256:58ac68a5b4978435ccbf261bef474f39ff94bc0b7d4a1ee9e90e4162983ef91a"
  },
  "attemptId": "qualify-native-amd64-1",
  "attemptFencingToken": 1,
  "qualificationSelectionDigest": "sha256:cdaaf1acb0b9c718ba23810c0b4a6a8edf3aec03f6a766958698f02726cbd143",
  "inputTreeDigest": "sha256:545d0f63cb61968cbc9baf4b647d25b735964d20edf398814e87ff17c02198cd",
  "contractBundleDigest": "sha256:87dbb879340741167ab45899d7a2bc36ae24247ecefe276b1d206f6210fb1b6b",
  "qualificationSuiteDigest": "sha256:d6a0eb9b4bf89dc41450578ec1b45353e02bf34a8d054bedfb7dc582b46b0558",
  "conformancePlanDigest": "sha256:02553fcdb228176babeafc445489685c040278e74fe8bcb2c3e4556d1d25fbaf",
  "inputCorpusDigest": "sha256:36d2ace03f79ea1827d60db53341635989941c7163c197a215b56938e1a80bf2",
  "evaluatorDistributionDigest": "sha256:146c5b8a1faa79183e822a1b8cfd5d8cbaf0b1b2ccb60502eb78b0c0dd4a816d",
  "qualificationWorkerProfileDigest": "sha256:c4d654a66a90705f63c460fc725354866827f0186bee49fd7ae235643302c384",
  "qualificationProtocolProfileDigest": "sha256:135ad2dd7dec9cc416f3272c495521580b5972cfde50ea9876020a239b992f42",
  "sandboxProfileDigest": "sha256:bae8babbab7c350f637eece710c26874dc98aa90ad8f75f6c87adb3be9cfd804",
  "resourceProfileDigest": "sha256:a8ea63935f5ef460ec6a9db7a16303084da85e62bd3e5128c341cb5a8a897a89",
  "timeoutProfileDigest": "sha256:776ec5b10927a8c66a9d1655e02076a7cbbf6669458c81657d5380822a911000",
  "issuerIdentityDigest": "sha256:c0f20100f445bb77249269e854c2c1b2743e089f031ca3692a5b2933197d7011",
  "issuedAt": "2026-07-17T11:59:00Z",
  "expiresAt": "2026-07-17T12:05:00Z",
  "authorityDigest": "sha256:88516e23bfe1825fc9607f2220e6347c90febc344b8316f4552d303fcc4cf12d",
  "framedRequestDigest": "sha256:5fd84967e7def4eb35383cf830039374d6c2a0f168156bd299ae40eec0b87fd2"
}
