{
  "contract": "bytedesk.renderer-qualification-attempt/1",
  "schema": {
    "id": "https://schemas.bytedesk.ai/agent-delivery/v1/renderer-qualification-attempt/1.0.0",
    "digest": "sha256:58ac68a5b4978435ccbf261bef474f39ff94bc0b7d4a1ee9e90e4162983ef91a"
  },
  "attemptId": "qualify-hermes-amd64-1",
  "attemptFencingToken": 1,
  "qualificationSelectionDigest": "sha256:30f440e8aaf7949994ecdf894db22720503873749a1c2c2b0c91be688c482838",
  "inputTreeDigest": "sha256:797a305c06d6ae2bad41ad5d278a90aac4b8568b60ef368b162efaa1e9ef6e1c",
  "contractBundleDigest": "sha256:00e015b2dea045c7bb14cdcd9c6c7c827812f5fae11a402a6010b4514a308b41",
  "qualificationSuiteDigest": "sha256:fd9f5caa497e5c204b5be3f0e7014c74c0162af949c2115611b6370fce037842",
  "conformancePlanDigest": "sha256:02553fcdb228176babeafc445489685c040278e74fe8bcb2c3e4556d1d25fbaf",
  "inputCorpusDigest": "sha256:36d2ace03f79ea1827d60db53341635989941c7163c197a215b56938e1a80bf2",
  "evaluatorDistributionDigest": "sha256:146c5b8a1faa79183e822a1b8cfd5d8cbaf0b1b2ccb60502eb78b0c0dd4a816d",
  "qualificationWorkerProfileDigest": "sha256:c4d654a66a90705f63c460fc725354866827f0186bee49fd7ae235643302c384",
  "qualificationProtocolProfileDigest": "sha256:135ad2dd7dec9cc416f3272c495521580b5972cfde50ea9876020a239b992f42",
  "sandboxProfileDigest": "sha256:bae8babbab7c350f637eece710c26874dc98aa90ad8f75f6c87adb3be9cfd804",
  "resourceProfileDigest": "sha256:a8ea63935f5ef460ec6a9db7a16303084da85e62bd3e5128c341cb5a8a897a89",
  "timeoutProfileDigest": "sha256:776ec5b10927a8c66a9d1655e02076a7cbbf6669458c81657d5380822a911000",
  "issuerIdentityDigest": "sha256:f40c397f977d2f2f9bf02be999ca189449f49db6b4363d08fb868c99b44af26c",
  "issuedAt": "2026-07-17T11:59:00Z",
  "expiresAt": "2026-07-17T12:05:00Z",
  "authorityDigest": "sha256:23fa1ba58c06485a46759a8c411e7abc5ae772e7650f9830e42d45ff0ab9e442",
  "framedRequestDigest": "sha256:474edd14b8da2cdc84849e5c3fa66c14689bfcdf45b64d7675948ffd03e131bf"
}
